{
  "version": "PlanV2",
  "plan_id": "plan_sess_001_1741270000",
  "session_id": "sess_001",
  "deck_fingerprint": "101-205-309",
  "source_skills": ["base-skill", "aggro-opening", "reaction-priority"],
  "global_goal": "Build tempo lead in turns 1-3 while preserving core unit HP.",
  "opening_window": {
    "start_turn": 1,
    "end_turn": 3
  },
  "turn_priorities": [
    {
      "turn": 1,
      "objectives": ["stabilize active character", "prepare reaction line"]
    },
    {
      "turn": 2,
      "objectives": ["convert dice efficiently", "secure first high-value trade"]
    }
  ],
  "risk_rules": [
    {
      "id": "risk_001",
      "condition": "required_dice_gap >= 2",
      "action": "avoid low-value commit",
      "priority": 90
    }
  ],
  "pivot_rules": [
    {
      "id": "pivot_001",
      "when": "core combo missing by turn 2",
      "then": "switch to conservative hp_stabilize line"
    }
  ],
  "trigger_rules": [
    {
      "id": "trg_001",
      "event": "active_character_defeated",
      "replan_scope": "opening",
      "cooldown_turns": 0
    }
  ],
  "fallback_rules": [
    {
      "id": "fb_001",
      "on_failure": "cannot execute best policy for 2 consecutive steps",
      "policy": "resource_hold"
    }
  ],
  "created_at": "2026-03-06T09:00:00.000Z",
  "updated_at": "2026-03-06T09:00:00.000Z",
  "notes": "Generated from selected skills and initial deck profile."
}
