{
  "version": "PlanV2",
  "plan_id": "plan_smoke_fragmented_1772874513566",
  "session_id": "smoke_fragmented",
  "deck_fingerprint": "unknown-deck",
  "source_skills": [
    "base-skill"
  ],
  "global_goal": "优先建立前 3 回合节奏优势，避免无效换血。",
  "opening_window": {
    "start_turn": 1,
    "end_turn": 3
  },
  "turn_priorities": [
    {
      "turn": 1,
      "objectives": [
        "建立元素附着",
        "争取高价值反应",
        "保留关键换人窗口"
      ]
    }
  ],
  "risk_rules": [],
  "pivot_rules": [],
  "trigger_rules": [],
  "fallback_rules": [],
  "created_at": "2026-03-07T09:08:33.566Z",
  "updated_at": "2026-03-07T09:08:33.566Z"
}